{"assets":[],"canvas":{"height":48,"originX":0,"originY":0,"width":64},"colour":{"conversionPolicy":"relative-colorimetric","declaredSpace":"srgb","workingProfileSha256":"1111111111111111111111111111111111111111111111111111111111111111"},"documentId":"00000000-0000-4000-8000-000000000115","engineCompatibility":{"alphaAssociation":"straight","bablTolerance":"0.0","bablVersion":"1:0.1.114-2","conversionPolicy":"relative-colorimetric","deterministicPreset":"f115-synthetic-h0-u16-v1","edgeMode":"clamp","geglVersion":"1:0.4.62-2+deb13u2","giFileSha256":"3333333333333333333333333333333333333333333333333333333333333333","maskFormat":"Y u8","maskSemantics":"foreground-alpha","operationCount":203,"operationSetSha256":"4444444444444444444444444444444444444444444444444444444444444444","packageGroupId":"plebian.f115.image-engine","packageGroupSha256":"2222222222222222222222222222222222222222222222222222222222222222","pluginTreeSha256":"5555555555555555555555555555555555555555555555555555555555555555","pythonGiVersion":"3.50.0-4+b1","resamplingKernel":"nohalo","schema":"kilix.imageshop.engine-compatibility/v1","swapCompression":"fast","threads":1,"tileCacheBytes":268435456,"tileHalos":[{"family":"default","pixels":0}],"useOpencl":false,"workingFormat":"RGBA u16","workingProfileSha256":"1111111111111111111111111111111111111111111111111111111111111111"},"layers":[],"provenance":[],"revisionId":"00000000-0000-4000-8000-000000000001","rootLayerIds":[],"schema":"kilix.imageshop.project/v1","selection":null}
